{
  "action_id": "act-93d0a5",
  "created_at": "2026-10-02T14:32:40Z",
  "source_agent": "guardian",
  "decision_id": "dec-7c2e41",
  "mode": "dry_run",
  "action_type": "block_ip_temporary",
  "target": "203.0.113.0/24",
  "ttl_minutes": 60,
  "summary": "Block the IP range behind the declined-card burst for one hour, pending human approval.",
  "requires_human_approval": true
}
